Reading OpenROAD database at '/home/kevinlim/rtl/serdes/backend/runs/RUN_2026-01-28_17-21-54/38-openroad-globalrouting/serdes_8bit.odb'…
Reading library file at '/home/kevinlim/.ciel/ciel/sky130/versions/0fe599b2afb6708d281543108caf8310912f54af/sky130A/libs.ref/sky130_fd_sc_hd/lib/sky130_fd_sc_hd__tt_025C_1v80.lib'…
Reading design constraints file at '/nix/store/dygnx4pddrv785rmrg7jb5gks9z6hrx7-python3-3.11.9-env/lib/python3.11/site-packages/librelane/scripts/base.sdc'…
[INFO] Using clock clk…
[INFO] Setting output delay to: 2
[INFO] Setting input delay to: 2
[INFO] Setting load to: 0.033442
[INFO] Setting clock uncertainty to: 0.25
[INFO] Setting clock transition to: 0.1499999999999999944488848768742172978818416595458984375
[INFO] Setting timing derate to: 5%
[INFO] Setting signal min routing layer to: met1 and clock min routing layer to met1. 
[INFO] Setting signal max routing layer to: met5 and clock max routing layer to met5. 
-congestion_iterations 50 -verbose
[INFO GRT-0020] Min routing layer: met1
[INFO GRT-0021] Max routing layer: met5
[INFO GRT-0022] Global adjustment: 30%
[INFO GRT-0023] Grid origin: (0, 0)
[INFO GRT-0043] No OR_DEFAULT vias defined.
[INFO GRT-0088] Layer li1     Track-Pitch = 0.4600  line-2-Via Pitch: 0.3400
[INFO GRT-0088] Layer met1    Track-Pitch = 0.3400  line-2-Via Pitch: 0.3400
[INFO GRT-0088] Layer met2    Track-Pitch = 0.4600  line-2-Via Pitch: 0.3500
[INFO GRT-0088] Layer met3    Track-Pitch = 0.6800  line-2-Via Pitch: 0.6150
[INFO GRT-0088] Layer met4    Track-Pitch = 0.9200  line-2-Via Pitch: 1.0400
[INFO GRT-0088] Layer met5    Track-Pitch = 3.4000  line-2-Via Pitch: 3.1100
[INFO GRT-0019] Found 10 clock nets.
[INFO GRT-0001] Minimum degree: 2
[INFO GRT-0002] Maximum degree: 13
[INFO GRT-0003] Macros: 0
[INFO GRT-0043] No OR_DEFAULT vias defined.
[INFO GRT-0004] Blockages: 1158

[INFO GRT-0053] Routing resources analysis:
          Routing      Original      Derated      Resource
Layer     Direction    Resources     Resources    Reduction (%)
---------------------------------------------------------------
li1        Vertical            0             0          0.00%
met1       Horizontal       3990          1923          51.80%
met2       Vertical         3165          1957          38.17%
met3       Horizontal       1995          1296          35.04%
met4       Vertical         1302           762          41.47%
met5       Horizontal        399           192          51.88%
---------------------------------------------------------------

[INFO GRT-0197] Via related to pin nodes: 2048
[INFO GRT-0198] Via related Steiner nodes: 19
[INFO GRT-0199] Via filling finished.
[INFO GRT-0111] Final number of vias: 2493
[INFO GRT-0112] Final usage 3D: 8380

[INFO GRT-0096] Final congestion report:
Layer         Resource        Demand        Usage (%)    Max H / Max V / Total Overflow
---------------------------------------------------------------------------------------
li1                  0             0            0.00%             0 /  0 /  0
met1              1923           440           22.88%             0 /  0 /  0
met2              1957           452           23.10%             0 /  0 /  0
met3              1296             9            0.69%             0 /  0 /  0
met4               762             0            0.00%             0 /  0 /  0
met5               192             0            0.00%             0 /  0 /  0
---------------------------------------------------------------------------------------
Total             6130           901           14.70%             0 /  0 /  0

[INFO GRT-0018] Total wirelength: 11516 um
[INFO GRT-0014] Routed nets: 432
[INFO GRT-0006] Repairing antennas, iteration 1.
[INFO GRT-0043] No OR_DEFAULT vias defined.
[INFO GRT-0012] Found 0 antenna violations.
Placement Analysis
---------------------------------
total displacement          0.0 u
average displacement        0.0 u
max displacement            0.0 u
original HPWL            5607.9 u
legalized HPWL           5963.2 u
delta HPWL                    6 %

[INFO DPL-0020] Mirrored 163 instances
[INFO DPL-0021] HPWL before            5963.2 u
[INFO DPL-0022] HPWL after             5607.9 u
[INFO DPL-0023] HPWL delta               -6.0 %
-congestion_iterations 50 -verbose
[INFO GRT-0020] Min routing layer: met1
[INFO GRT-0021] Max routing layer: met5
[INFO GRT-0022] Global adjustment: 30%
[INFO GRT-0023] Grid origin: (0, 0)
[INFO GRT-0043] No OR_DEFAULT vias defined.
[INFO GRT-0088] Layer li1     Track-Pitch = 0.4600  line-2-Via Pitch: 0.3400
[INFO GRT-0088] Layer met1    Track-Pitch = 0.3400  line-2-Via Pitch: 0.3400
[INFO GRT-0088] Layer met2    Track-Pitch = 0.4600  line-2-Via Pitch: 0.3500
[INFO GRT-0088] Layer met3    Track-Pitch = 0.6800  line-2-Via Pitch: 0.6150
[INFO GRT-0088] Layer met4    Track-Pitch = 0.9200  line-2-Via Pitch: 1.0400
[INFO GRT-0088] Layer met5    Track-Pitch = 3.4000  line-2-Via Pitch: 3.1100
[INFO GRT-0019] Found 10 clock nets.
[INFO GRT-0001] Minimum degree: 2
[INFO GRT-0002] Maximum degree: 13
[INFO GRT-0003] Macros: 0
[INFO GRT-0043] No OR_DEFAULT vias defined.
[INFO GRT-0004] Blockages: 1158

[INFO GRT-0053] Routing resources analysis:
          Routing      Original      Derated      Resource
Layer     Direction    Resources     Resources    Reduction (%)
---------------------------------------------------------------
li1        Vertical            0             0          0.00%
met1       Horizontal       3990          1923          51.80%
met2       Vertical         3165          1957          38.17%
met3       Horizontal       1995          1296          35.04%
met4       Vertical         1302           762          41.47%
met5       Horizontal        399           192          51.88%
---------------------------------------------------------------

[INFO GRT-0197] Via related to pin nodes: 2048
[INFO GRT-0198] Via related Steiner nodes: 19
[INFO GRT-0199] Via filling finished.
[INFO GRT-0111] Final number of vias: 2493
[INFO GRT-0112] Final usage 3D: 8380

[INFO GRT-0096] Final congestion report:
Layer         Resource        Demand        Usage (%)    Max H / Max V / Total Overflow
---------------------------------------------------------------------------------------
li1                  0             0            0.00%             0 /  0 /  0
met1              1923           440           22.88%             0 /  0 /  0
met2              1957           452           23.10%             0 /  0 /  0
met3              1296             9            0.69%             0 /  0 /  0
met4               762             0            0.00%             0 /  0 /  0
met5               192             0            0.00%             0 /  0 /  0
---------------------------------------------------------------------------------------
Total             6130           901           14.70%             0 /  0 /  0

[INFO GRT-0018] Total wirelength: 11516 um
[INFO GRT-0014] Routed nets: 432
[INFO] Setting RC values…
Setting global connections for newly added cells…
[INFO] Setting global connections...
Updating metrics…
Cell type report:                       Count       Area
  Fill cell                                62     232.72
  Tap cell                                 99     123.87
  Clock buffer                             13     274.01
  Timing Repair Buffer                    119    1028.49
  Inverter                                 10      37.54
  Clock inverter                            3      42.54
  Sequential cell                          85    1669.10
  Multi-Input combinational cell          198    1582.77
  Total                                   589    4991.04
Writing OpenROAD database to '/home/kevinlim/rtl/serdes/backend/runs/RUN_2026-01-28_17-21-54/41-openroad-repairantennas/1-diodeinsertion/serdes_8bit.odb'…
Writing layout to '/home/kevinlim/rtl/serdes/backend/runs/RUN_2026-01-28_17-21-54/41-openroad-repairantennas/1-diodeinsertion/serdes_8bit.def'…
